{
  "$schema": "https://json-schema.org/draft/2020-12/schema",
  "$id": "https://psyml.dev/schemas/analysis-config-1.0.json",
  "title": "PsyML analysis configuration",
  "type": "object",
  "additionalProperties": false,
  "required": ["schema_version", "task", "target_column", "model_name", "input_path", "output_dir"],
  "properties": {
    "schema_version": {"const": "1.0"},
    "selection_protocol": {"const": "nested_family_v1"},
    "task": {"enum": ["classification", "regression"]},
    "target_column": {"type": "string", "minLength": 1},
    "model_name": {"type": "string", "minLength": 1},
    "input_path": {"type": ["string", "null"]},
    "output_dir": {"type": "string", "minLength": 1},
    "group_column": {"type": ["string", "null"]},
    "feature_columns": {
      "type": ["array", "null"],
      "items": {"type": "string", "minLength": 1},
      "minItems": 1,
      "uniqueItems": true
    },
    "test_size": {"type": "number", "exclusiveMinimum": 0, "exclusiveMaximum": 1},
    "random_seed": {"type": "integer"},
    "primary_validation": {"enum": [null, "first_selected", "holdout", "k_fold", "stratified_k_fold", "group_k_fold", "stratified_group_k_fold", "leave_one_group_out"]},
    "validation_strategy": {"enum": ["holdout", "k_fold", "stratified_k_fold", "group_k_fold", "stratified_group_k_fold", "leave_one_group_out"]},
    "n_splits": {"type": "integer", "minimum": 2},
    "missing_strategy": {"enum": ["drop", "mean", "median", "mode"]},
    "scaling": {"enum": ["none", "standard", "minmax"]},
    "figure_types": {
      "type": ["array", "null"],
      "items": {"enum": ["confusion_matrix", "class_distribution", "observed_vs_predicted", "residuals", "residual_distribution"]},
      "uniqueItems": true
    },
    "save_best_model": {"type": "boolean", "default": true},
    "include_data_hash": {"type": "boolean"},
    "model_params": {"type": "object"},
    "model_names": {
      "type": ["array", "null"],
      "items": {"type": "string", "minLength": 1},
      "minItems": 1,
      "uniqueItems": true
    },
    "validation_strategies": {
      "type": ["array", "null"],
      "items": {"enum": ["holdout", "k_fold", "stratified_k_fold", "group_k_fold", "stratified_group_k_fold", "leave_one_group_out"]},
      "minItems": 1,
      "uniqueItems": true
    },
    "tuning_mode": {"enum": ["none", "quick", "custom"]},
    "parameter_grids": {
      "type": "object",
      "additionalProperties": {
        "type": "object",
        "additionalProperties": {"type": "array", "minItems": 1}
      }
    },
    "selection_metric": {"type": ["string", "null"]},
    "inner_splits": {"type": "integer", "minimum": 2},
    "max_candidates": {"type": "integer", "minimum": 1, "maximum": 200},
    "permutation_importance": {"type": "boolean", "default": false},
    "permutation_repeats": {"type": "integer", "minimum": 1, "maximum": 100, "default": 10}
  }
}
