{
  "feature_columns": [
    "score",
    "category"
  ],
  "group_column": "participant",
  "include_data_hash": true,
  "inner_splits": 2,
  "input_path": "/tmp/PsyML-cua/classification.csv",
  "max_candidates": 2,
  "missing_strategy": "mean",
  "model_name": "qda",
  "model_names": [
    "qda"
  ],
  "model_params": {},
  "n_splits": 3,
  "output_dir": "/tmp/PsyML-cua/qda-custom",
  "parameter_grids": {
    "qda": {
      "reg_param": [
        0.1,
        0.5
      ]
    }
  },
  "random_seed": 42,
  "scaling": "minmax",
  "schema_version": "1.0",
  "selection_metric": "f1_macro",
  "selection_protocol": "nested_family_v1",
  "target_column": "target",
  "task": "classification",
  "test_size": 0.2,
  "tuning_mode": "custom",
  "validation_strategies": [
    "group_k_fold"
  ],
  "validation_strategy": "group_k_fold"
}
